{
  "schema": "fabric-package/1",
  "kind": "agent",
  "id": "inbox-digest",
  "version": "1.2.0",
  "publisher": "example",
  "agentRef": "urn:fabric:agent:example:inbox-digest",
  "licence": "AGPL-3.0-only OR LicenseRef-Example-Commercial",
  "runners": [
    "claude-code"
  ],
  "skills": [
    "digest"
  ],
  "allowedToolsCeiling": [
    "Read",
    "mcp__inbox-digest__*"
  ],
  "listingChars": 96,
  "provider": "fabric-agent.json",
  "service": {
    "id": "inbox-digest",
    "name": "Inbox digest",
    "summary": "Writes one digest of a mailbox each morning.",
    "entry": [
      "bin/serve.mjs"
    ],
    "runtime": {
      "name": "node",
      "version": ">=22"
    }
  },
  "secrets": [
    {
      "name": "MAIL_OAUTH",
      "purpose": "Reads the mailbox the digest summarises"
    }
  ],
  "requires": {
    "servers": [
      "mail-gateway"
    ],
    "packages": [
      {
        "publisher": "example",
        "id": "writing-rules",
        "range": "^1"
      }
    ],
    "platforms": [
      "darwin",
      "linux",
      "windows"
    ],
    "gpu": false
  },
  "costPresets": [
    {
      "id": "quick",
      "capability": "digest.write",
      "label": "Quick",
      "maxUsd": 0.05,
      "default": true
    },
    {
      "id": "thorough",
      "capability": "digest.write",
      "label": "Thorough",
      "maxUsd": 0.4
    }
  ],
  "resultSignal": {
    "name": "digest-written",
    "says": "done when the digest is written"
  },
  "state": [
    {
      "path": "digests",
      "purpose": "Digests already written, so none is written twice"
    }
  ],
  "evals": {
    "suite": "evals/suite.json",
    "receipt": {
      "ranAt": "2026-10-12T08:30:00Z",
      "suite": "sha256:b7f7411abceb3c9160745afdeb4cfad044ed49c926ae2c54e3b59d33675b8437",
      "passed": 1,
      "failed": 0
    }
  },
  "dependencies": [
    {
      "ecosystem": "npm",
      "name": "mail-parser",
      "version": "4.1.0",
      "sha256": "sha256:052a28297edf6760ee10e648408bf5ff3104d4559cf57aaa114615bd09ced88d",
      "path": "vendor/other.tgz"
    },
    {
      "ecosystem": "npm",
      "name": "html-to-text",
      "version": "9.0.5",
      "sha256": "sha256:ba1d6bf173f323548886fbb322b57361d6f81614af7e32b70b9f6b0ad4e2a0aa"
    }
  ],
  "files": [
    {
      "path": ".claude-plugin/plugin.json",
      "sha256": "sha256:1a5289f35c70db070f92b1171dd1b700b32d35d4d277c10fbbe8906281c592f1"
    },
    {
      "path": "bin/serve.mjs",
      "sha256": "sha256:7c73dbd59c796c2abf11faaf5dd5154f23d41bd663e2202bf0724b09bbb57af4"
    },
    {
      "path": "evals/inputs/morning.json",
      "sha256": "sha256:2ba9f74506f79bccad45892b6e032c925531c15c03160046317f8e05dbf8486d"
    },
    {
      "path": "evals/suite.json",
      "sha256": "sha256:b7f7411abceb3c9160745afdeb4cfad044ed49c926ae2c54e3b59d33675b8437"
    },
    {
      "path": "fabric-agent.json",
      "sha256": "sha256:6353fff99eb6e5b729706c05f5b2a985f686d427b383e0ce2f63a639a852fb8d"
    },
    {
      "path": "lib/server.mjs",
      "sha256": "sha256:1df8ae90b21b2a990ea6723c3c016b27887b39f4de36fefd91915d04bb564273"
    },
    {
      "path": "skills/digest/SKILL.md",
      "sha256": "sha256:fe14a6a3cd2aad3ae287609a26cb2c765151947e614cfa56657a07639500ff9e"
    },
    {
      "path": "vendor/mail-parser-4.1.0.tgz",
      "sha256": "sha256:052a28297edf6760ee10e648408bf5ff3104d4559cf57aaa114615bd09ced88d"
    }
  ],
  "digest": "sha256:35b11322e9e2cb3c9f3662df04ffd2bc1200c1693e0fe41d8cad63edfd073431",
  "signatures": [
    {
      "role": "publisher",
      "alg": "EdDSA",
      "kid": "example-publisher-2026",
      "sig": "662TlCVUlWC8dPIZqDrtmZ994m9Ld4DHUSrcBp9HQwINuifDbTNgqUD4OC0dmxhm_GYKT7Dbyrk1JHFO2d-bCw"
    },
    {
      "role": "organization",
      "alg": "EdDSA",
      "kid": "example-org-admin-1",
      "sig": "_6VD2nrzvs0g6kiBNRCIRRYH-OsUoq1um3dfdDGOAjnpXClEY_KlXxWoNoMcpe2AYaOh1q4M05yIQ3Uz4t4GAQ"
    }
  ]
}
